<?xml version="1.0" encoding="UTF-8"?>
<xs:schema xmlns:xs="http://www.w3.org/2001/XMLSchema" elementFormDefault="qualified"
           targetNamespace="http://www.ftn.uns.ac.rs/korisnik"
           xmlns:kor="http://www.ftn.uns.ac.rs/korisnik">

    <xs:element name="korisnik">
        <xs:complexType>
            <xs:sequence>
                <xs:element name="drzavljanstvo" type="xs:string"/>
                <xs:element name="jmbg" type="xs:string"/>
                <xs:element name="broj_pasosa" type="xs:string"/>
                <xs:element name="ime" type="xs:string"/>
                <xs:element name="prezime" type="xs:string"/>
                <xs:element name="ime_roditelja" type="xs:string"/>
                <xs:element name="pol">
                    <xs:simpleType>
                        <xs:restriction base="xs:string">
                            <xs:enumeration value="muski"/>
                            <xs:enumeration value="zenski"/>
                        </xs:restriction>
                    </xs:simpleType>
                </xs:element>
                <xs:element name="datum_rodjenja" type="xs:date"/>
                <xs:element name="mesto_rodjenja" type="xs:string"/>
                <xs:element name="adresa" type="xs:string"/>
                <xs:element name="mesto" type="xs:string"/>
                <xs:element name="grad" type="xs:string"/>
                <xs:element name="fiksni_telefon" type="xs:string"/>
                <xs:element name="mobilni_telefon" type="xs:string"/>
                <xs:element name="email" type="xs:string"/>
                <xs:element name="sifra" type="xs:string"/>
                <xs:element name="rola">
                    <xs:simpleType>
                        <xs:restriction base="xs:string">
                            <xs:enumeration value="gradjanin"/>
                            <xs:enumeration value="sluzbenik"/>
                            <xs:enumeration value="zdravstveni_radnik"/>
                        </xs:restriction>
                    </xs:simpleType>
                </xs:element>
            </xs:sequence>
        </xs:complexType>
    </xs:element>
</xs:schema>